{
  "schemaVersion": "yolovision-output.v1",
  "task": "sem",
  "modelFamily": "custom",
  "input": {
    "path": "synthetic-ramp",
    "sha256": "",
    "width": 512,
    "height": 512,
    "sourceKind": "synthetic-pattern"
  },
  "engine": {
    "path": "",
    "sha256": "",
    "inputShape": [1, 3, 512, 512],
    "precision": "unknown",
    "materialization": "in-memory-from-onnx",
    "modelPath": "owner-sem.onnx",
    "modelSha256": "",
    "engineDeviceMemoryBytes": 0
  },
  "runtime": {
    "os": "example",
    "rid": "example",
    "cudaVersion": "captured-by-run-log",
    "tensorRtVersion": "line-11",
    "runtimePackageId": "owner-record-required",
    "tensorRtLine": 11,
    "profileIndex": 0,
    "elapsedMilliseconds": 0
  },
  "outputs": [
    {
      "name": "semantic",
      "role": "semantic",
      "shape": [1, 21, 512, 512],
      "elementCount": 5505024
    }
  ],
  "postprocess": {
    "confidenceThreshold": 0.0,
    "nmsThreshold": 0.0,
    "topK": 1,
    "applyNms": false,
    "nmsMode": "None",
    "layout": "Auto",
    "angleUnit": "unknown",
    "angleRange": "owner-record-required"
  },
  "predictions": [
    {
      "task": "sem",
      "classCount": 21,
      "width": 512,
      "height": 512,
      "valueCount": 5505024
    }
  ],
  "boundary": {
    "isRuntimeProof": false,
    "evidenceKind": "YoloVision output schema; readonly diagnostics; not runtime proof",
    "forbiddenSubstitutes": [
      "build-only",
      "dry-run",
      "template",
      "local feed",
      "ProjectReference",
      "direct `.nupkg`",
      "TensorRtExec report",
      "YoloVision matrix",
      "OnnxToEngine report",
      "readonly diagnostics"
    ]
  }
}
