{
  "schemaVersion": "yolovision-output.v1",
  "task": "pose",
  "modelFamily": "yolov8",
  "input": {
    "path": "synthetic-ramp",
    "sha256": "",
    "width": 640,
    "height": 640,
    "sourceKind": "synthetic-pattern"
  },
  "engine": {
    "path": "",
    "sha256": "",
    "inputShape": [1, 3, 640, 640],
    "precision": "unknown",
    "materialization": "in-memory-from-onnx",
    "modelPath": "owner-pose.onnx",
    "modelSha256": "",
    "engineDeviceMemoryBytes": 0
  },
  "runtime": {
    "os": "example",
    "rid": "example",
    "cudaVersion": "captured-by-run-log",
    "tensorRtVersion": "line-11",
    "runtimePackageId": "owner-record-required",
    "tensorRtLine": 11,
    "profileIndex": 0,
    "elapsedMilliseconds": 0
  },
  "outputs": [
    {
      "name": "boxes",
      "role": "boxes",
      "shape": [1, 1, 5],
      "elementCount": 5
    },
    {
      "name": "keypoints",
      "role": "keypoints",
      "shape": [1, 1, 51],
      "elementCount": 51
    }
  ],
  "postprocess": {
    "confidenceThreshold": 0.25,
    "nmsThreshold": 0.45,
    "topK": 100,
    "applyNms": true,
    "nmsMode": "ClassAware",
    "layout": "BoxesFirst",
    "angleUnit": "unknown",
    "angleRange": "owner-record-required"
  },
  "predictions": [
    {
      "task": "pose",
      "box": { "x": 300.0, "y": 310.0, "width": 110.0, "height": 220.0 },
      "score": 0.86,
      "keypoints": [
        { "index": 0, "x": 295.0, "y": 250.0, "score": 0.92, "visibility": 1.0 },
        { "index": 1, "x": 315.0, "y": 252.0, "score": 0.9, "visibility": 1.0 }
      ]
    }
  ],
  "boundary": {
    "isRuntimeProof": false,
    "evidenceKind": "YoloVision output schema; readonly diagnostics; not runtime proof",
    "forbiddenSubstitutes": [
      "build-only",
      "dry-run",
      "template",
      "local feed",
      "ProjectReference",
      "direct `.nupkg`",
      "TensorRtExec report",
      "YoloVision matrix",
      "OnnxToEngine report",
      "readonly diagnostics"
    ]
  }
}
