{
  "schemaVersion": "yolovision-output.v1",
  "task": "seg",
  "modelFamily": "yolov8",
  "input": {
    "path": "synthetic-ramp",
    "sha256": "",
    "width": 640,
    "height": 640,
    "sourceKind": "synthetic-pattern"
  },
  "engine": {
    "path": "",
    "sha256": "",
    "inputShape": [1, 3, 640, 640],
    "precision": "unknown",
    "materialization": "in-memory-from-onnx",
    "modelPath": "owner-seg.onnx",
    "modelSha256": "",
    "engineDeviceMemoryBytes": 0
  },
  "runtime": {
    "os": "example",
    "rid": "example",
    "cudaVersion": "captured-by-run-log",
    "tensorRtVersion": "line-11",
    "runtimePackageId": "owner-record-required",
    "tensorRtLine": 11,
    "profileIndex": 0,
    "elapsedMilliseconds": 0
  },
  "outputs": [
    {
      "name": "boxes",
      "role": "boxes",
      "shape": [1, 1, 38],
      "elementCount": 38
    },
    {
      "name": "proto",
      "role": "prototypes",
      "shape": [32, 160, 160],
      "elementCount": 819200
    }
  ],
  "postprocess": {
    "confidenceThreshold": 0.25,
    "nmsThreshold": 0.45,
    "maskThreshold": 0.5,
    "topK": 100,
    "applyNms": true,
    "nmsMode": "ClassAware",
    "layout": "BoxesFirst",
    "angleUnit": "unknown",
    "angleRange": "owner-record-required"
  },
  "predictions": [
    {
      "task": "seg",
      "box": { "x": 288.0, "y": 300.0, "width": 150.0, "height": 90.0 },
      "classId": 0,
      "className": "person",
      "score": 0.88,
      "maskShape": [160, 160],
      "maskPixelCount": 4200,
      "maskThreshold": 0.5
    }
  ],
  "boundary": {
    "isRuntimeProof": false,
    "evidenceKind": "YoloVision output schema; readonly diagnostics; not runtime proof",
    "forbiddenSubstitutes": [
      "build-only",
      "dry-run",
      "template",
      "local feed",
      "ProjectReference",
      "direct `.nupkg`",
      "TensorRtExec report",
      "YoloVision matrix",
      "OnnxToEngine report",
      "readonly diagnostics"
    ]
  }
}
